name,category
Nike Jordan Mens Lift Off Leather Synthetic Trainers,5
Air Jordan Coloring Book: Sneaker Adult Coloring Book,7
Jordan Air Future Low,5
Nike Air Jordan Mens Generation 23 Basketball Shoes AA1294 004 New (11),5
Nike Men's Air Jordan 1 Mid Basketball Shoe,5
Nike AIR Jordan Legacy 312 Mens Fashion-Sneakers AV3922,5
Jordan Kids' Air 12 Retro Bg French Black/Red,5
Nike Air Jordan 1 Mid White/Black-White (14 D(M) US),5
Nike Men's Air Jordan 1 Retro High OG 'Origin Story' Red/White 555088-602,5
Nike Jordan Men's Air Jordan XXXII Basketball Shoes,5
Nike Mens Air Jordan 12 Retro Gym Red/Black Suede Size 9.5,5
Nike Air Jordan Protro Max 720 Bred Black Gym Red BQ6623-600 US Size 12,5
"Nike Air Jordan 10 X Retro NYC Premium basketball shoes Sneaker different colors, EU Shoe Size:EUR 38.5, Color:black",5
Jordan Nike Men's Air Legacy Elephant Print-Black/Red 312 AV3922-006,5
Men Mesh Letter Solid Elastic Running Sport Flat Ankle Round Toe Casual Shoes,18
Nike Men's Air Huarache Running Shoe,5
Nike Jordan Men's Retro 6 Leather Basketball Shoes,5
Nike Jordan Air Jumpman Backpack Book Bag-Black/Red,5
Nike Mens Air Jordan Retro 1 Mid Basketball Shoes Black/Dark Grey/Black 554724-050 Size 8.5,5
Jordan Air TE 2 Low,5
No.66 TOWN Men's Air Shock Absorption Running Tennis Shoes Sneaker Basketball Shoes,5
"NIKE Jordan Men's Air Future, Phantom/Phantom-SAIL-White",5
Jordan Nike Men's Air 1 Retro Hi Double Strap Basketball Shoe,5
"Nike Mens Jordan Retro 11 ""Concord"" Basketball Shoe",5
Jordan Kids' Grade School Air Retro 11 Basketball Shoes,5
"Nike Air Jordan 1 Retro High OG NRG 861426 061""Homage to Home",5
Jordan Kids' Nike Air 10 Retro Gs,5
Nike Men's Air Ring Leader Low Basketball Shoe,5
"Nike Air Jordan Ele-mentary Backpack for 15"" Laptop in Black and Gray Elephant",4
Nike Air Jordan 23 Jumpman Backpack School,5
Nike Air Jordan Kids Square Lunch Tote,11
Jordan Eclipse Men US 9 Black Sneakers,5
Nike Air Jordan Baby Boy's Booties Socks Size 0-6 Months Baby Gift Set,5
"Original Nike Air Jordan 5 Patent Poster Prints- Set of 2 (Two 11x14) Unframed Pictures- Great Wall Art Decor Gift for Home, Office, Studio, Garage, Man Cave, Gym, Student, Chicago-Basketball Fan",8
AIR Jordan 13 Retro 'BRED' - 414571-004,5
Nike Men's AIR Jordan Zoom Tenacity Shoe Black (10.5 D(M) US),5
Nike Men's Air Max Fury Running Shoe,5
"Bosch BC537 QuietCast Premium Ceramic Disc Brake Pad Set For: Acura CL, CSX, ILX, RSX, TL, TSX, Vigor; Honda Accord, Civic, CR-Z, Prelude, S2000; Suzuki Kizashi, SX4, Rear",16
Samsung Galaxy S9 Unlocked Smartphone - 64GB - Midnight Black - US Warranty,3
Samsung Galaxy S9 Unlocked - 64gb - Midnight Black - US Warranty (Renewed),3
Samsung Galaxy S9+ Unlocked - 64gb - Midnight Black - US Warranty (Renewed),3
Samsung Galaxy S9 SM-G960U 64GB Blue AT&T (Unlocked) (Renewed),3
"Samsung Galaxy S9 (SM-G960F/DS) 4GB / 64GB 5.8-inches LTE Dual SIM (GSM Only, No CDMA) Factory Unlocked - International Stock No Warranty (Midnight Black, Phone Only)",3
Samsung Galaxy S9 SM-G960U 64GB for Verizon (Renewed),3
Samsung Galaxy S9 Plus Verizon + GSM Unlocked 64GB Lilac Purple (Renewed),3
Samsung Galaxy S8 Unlocked 64GB -  Midnight Black  [US Version],3
Samsung Galaxy S8 - 64GB - Midnight Black - Verizon + GSM Factory Unlocked 4G LTE (Renewed),3
"Samsung Galaxy S9 Screen Protector Xawy [2-Pack], [Case-Friendly] Tempered Glass Screen Protector for Samsung Galaxy S9 - (Clear)",3
Samsung Galaxy S9 Plus (SM-G965F/DS) 6GB / 128GB 6.2-inches LTE Dual SIM Factory Unlocked - International Stock No Warranty (Midnight Black),3
Samsung Galaxy S8 Plus Unlocked 64GB (Midnight Black) - (Certified Refurbished),3
"Galaxy S9 Case, YOUMAKER Metallic Blue with Built-in Screen Protector Heavy Duty Protection Shockproof Slim Fit Full Body Case Cover for Samsung Galaxy S9 5.8 inch (2018) - Blue/Black",3
"Samsung Galaxy S9 Plus (6.2"", Dual SIM) 64GB SM-G965F/DS Factory Unlocked LTE Smartphone (Lilac Purple) - International Version",3
Canada Goose Men's Expedition Parka Coat,6
Canada Goose Women's Shelburne Parka Coat,5
Canada Goose Men's Langford Parka Cpat,6
Canada Goose Women's Expedition Parka,6
Canada Goose Women's Kensington Parka Coat,6
Canada Goose Men's Carson Parka,5
Orolay Women's Thickened Down Jacket (Most Wished &Gift Ideas),6
Canada Goose Men's Wyndham Parka,6
Canada Goose Men's Langford Parka,5
Canada Goose Ladies Montebello Parka Coat,6
Canada Goose Expedition Polar Bear International Parka,6
Canada Goose Men's Chilliwack Bomber,5
Canada Goose Women's Montebello Parka,6
Canada Goose Boys Vernon Parka,6
Canada Goose Youth Vanier Vest,6
Canada Goose Women's Trillium Parka,6
Canada Goose Women's Huron Bomber Jacket,6
Canada Goose Women's Olympia Down Parka Jacket,5
Canada Goose Women's Chilliwack Bomber,6
"Canada Goose Men's Chateau Parka, No Fur",5
Canada Goose Women's Montebello Parka Algonquin Green XX-Small,6
Realistic Canada Goose T-Shirt,5
Canada Goose Banff Parka Coat,5
Canada Goose Youth Wolverine Pants,6
Canada Goose Brookvale Mens Jacket Medium Black/Graphite,5
Moose Knuckles Down 3/4 Jacket,5
"Canada Goose Women's Shelburne Parka Coat, Non-Fur",5
Canada Goose Men's Lodge Jacket,5
Canada Goose Citadel Parka,5
Woolrich Men's Arctic Parka,6
Canada Goose Men's Citadel Parka Coat,6
Canada Goose Standing Pullover Hoodie Waterfowl Lover,5
1967 CA Canada Silver Dollar Flying Goose AU/BU &/or Proof Silver About Uncirculated,15
"PUREMSX Mens Winter Jacket, Extremely Thicken Quilted Fur Hooded Long Anorak Parka Padded Coat",6
Canada Goose Custom Embroidered Sweatshirt Shirt,8
Arc'teryx Atom LT Hoody Men's,5
Arc'teryx Covert Cardigan Men's,5
Arc'teryx Captive Polo Shirt Short Sleeve Men's,5
Arc'teryx Men's Squamish Hoody,5
Arc'teryx Men's Delta Lt Jacket,5
Arc'teryx Atom AR Hoody Men's                              ,5
Arc'teryx Men's Cerium LT Hooded Jacket,5
Arc'teryx Men's Beta Sl Jacket,5
Arc'teryx Men's Alpha SV Jacket,5
Arc'teryx Bird Head Toque,5
Arc'teryx Atom LT Jacket Men's,5
Arc'teryx Men's Skyline Short Sleeve Shirt,5
Arc'teryx Thorium AR Hoody Men's,5
Arc'teryx Atom LT Vest Men's    ,5
Arc'teryx Men's Camosun Parka,5
Arc'teryx Skyline Shirt LS Men’s,5
Arcteryx Alpha AR Jacket - Men's,6
Arc'teryx Men's Atom SL Hoodie,5
Arc'teryx Men's Gamma Mx Hoody,5
Arc'teryx Men's Gamma LT Pants,6
 Arc'teryx Thorium AR Jacket Men's,5
Arc'teryx Slingblade 4 Shoulder Bag (Pilot),5
Arc'teryx Mens Motus Crew S/S,5
Arc'teryx Men's Chilco Short Sleeve Polo,5
Arc'teryx Kyanite Jacket Men's,5
Arc'teryx Delta LT Zip Neck Men’s,5
Arc'teryx Blade 20 Backpack,5
Arc'teryx Gamma LT Jacket Men's,5
Arc'teryx Rho AR Zip Neck Men's,6
Arc'teryx Index 15 Backpack,5
Arc'teryx Men's Aerios FL Mid GTX,5
Arc'teryx Men's Captive Long Sleeve Polo,5
Arc'teryx Women's Cerium LT Hoodie,5
Arc'teryx Men's Lefroy Shorts,5
Arc'teryx Women's Atom LT Hoodie,5
Arc'teryx Men's Norvan LD Shoes,5
Arc'teryx Stowe Pant Men's,5
Arc'teryx Covert Case C/O,5
Arc'teryx Index Large Toiletries Bag,2
Arc'teryx Beta SL Pant - Men's,5
Arc'teryx Men's Norvan SL GTX,5
Arc'teryx Calvus Cap,5
Arc'teryx Bird Cap,5
Arc'teryx Women's Atom Lt Hoody,5
Arc'teryx Venta Glove,5
"BlackRapid Breathe Backpack Camera Strap, 1pc of Safety Tether Included",4
"Samsung Galaxy S8 (G950u GSM only) 5.8"" Unlocked Smartphone for All GSM Carriers - Midnight Black (Certified Refurbished)",3
Samsung Galaxy S8 64GB Unlocked Phone - International Version (Midnight Black),3
Samsung Galaxy S8 SM-G950U 64GB for AT&T (Renewed),3
Samsung Galaxy S8 Unlocked 64GB - US Version (Orchid Gray) - US Warranty (Renewed),3
"Samsung Galaxy S8 G950FD 64GB Midnight Black, Dual Sim, 5.8 inches, 4GB Ram, GSM Unlocked International Model, No Warranty",3
"Samsung Galaxy S8 Active (G892A) GSM Unlocked Military-Grade Durable Smartphone w/ 5.8in Shatter-Resistant Glass, Meteor Gray (Renewed)",3
Samsung Galaxy S8 Plus SM-G955U 64GB for Verizon (Renewed),3
"Samsung Galaxy S8+ 64GB Unlocked Phone - 6.2"" Screen - International Version (Midnight Black)",3
Samsung Galaxy S8 64GB Phone - 5.8in Unlocked Smartphone - Midnight Black (Renewed),3
Samsung Galaxy S8 SM-G950U 64GB for T-Mobile (Renewed),3
"Galaxy S8 Plus Screen Protector, [2PACK][9H Hardness][Anti-Scratch][Anti-Bubble][3D Curved] [High Definition] [Ultra Clear] Glass Screen Protector Compatible Samsung Galaxy S8 Plus Clear",3
[2 Pack] Galaxy S8 Plus Screen Protector.DRGSDR Privacy Tempered Glass Anti - Spy. 3D Curved. Case Friendly. Screen Protector Shield for Samsung Galaxy S8 Plus. Transparent. Upgraded Version,3
Samsung Galaxy S8 Plus Screen Protector Xawy [2-Pack] [Case-Friendly] Tempered Glass Screen Protector for Samsung Galaxy S8 Plus - (Clear),3
"ESTEE LAUDER Advanced Night Repair Recovery Complex Ii, 1.7 Ounce",2
"Estee Lauder Daywear Advanced Multi Protection Anti Oxidant Creme All Skin Types for Unisex, 1.7 Ounce",2
"Estee Lauder Advanced Time Zone Night Age Reversing Line/Wrinkle Creme, 1.7 Ounce",2
Estee Lauder 2018 Holiday Blockbuster Gift Set $440+ Value Cool Color,2
Estee Lauder Double Wear Stay-in-Place Makeup-2N1 Desert Beige,2
Estee Lauder 2018 Holiday Blockbuster Gift Set $440+ Value Warm Color,2
Estee Lauder - Advanced Night Repair Synchronized Recovery Complex II - 50ml/1.7oz by Estee Lauder,2
Beautiful By Estee Lauder For Women. Eau De Parfum Spray 2.5 Ounces,2
"Estee Lauder Perfectly Clean Multi-action Foam Cleanser/Purifying Mask, 5 Ounce",2
Estee Lauder Daywear Advanced Multi-protection Anti-oxidant Creme SPF 15 (Normal/combination) 1.7 Oz/ 50 Ml,2
"Estee Lauder Resilience Lift Firming/Sculpting Face and Neck Creme, 1.7 Ounce",2
Youth Dew by Estee Lauder for Women - 2.25 Ounce EDP Spray,2
Estee Lauder Resilience Lift Firming/Sculpting Face and Neck Creme Broad Spectrum SPF 15 for Normal / Combination Skin 1.7 oz,2
ESTEE LAUDER REVITALIZING SUPREME GLOBAL ANTI AGING CREME SET by Estee Lauder,2
"Estee Lauder Advanced Night Repair Eye Cream Synchronized Complex II, 0.5 Ounce",2
"Estee Lauder Idealist Pore Minimizing Skin Refinisher, 1.7 Ounce",2
"ESTEE LAUDER Perfectionist Firming Serum, 1.7 Ounce",2
Estee Lauder Advanced Night Repair Eye Concentrate Matrix 15ml/0.5oz,2
"Estee Lauder Revitalizing Supreme Plus Global Anti-aging Creme for Women, 1 Ounce",2
"Estee Lauder Sumptuous Extreme Lash Multiplying Volume Mascara for Women, No.01 Extreme Black, 0.27 Ounce",2
Sensuous by Estee Lauder for Women - 3.4 Ounce EDP Spray,2
"Estee Lauder Resilience Night Firming/Sculpting Face/Neck Creme (All Skin Types) for Unisex, 1.7 Ounce",2
"ESTEE LAUDER Modern Muse Eau de Parfum Spray for Women, 3.4 Ounce",2
"Estee Lauder Perfectionist Youth-Infusing Makeup Spf 25, Fresco, 1 Ounce",2
"Estee Lauder Advanced Night Repair Synchronized Recovery Complex II Promo Size (Pack of 4, 7ml/0.24oz Each, 28ml/0.96oz Total)",2
"Estee Lauder Hydrationist Maximum Moisture Creme Normal/Combination Skin for Unisex, 1.7 Ounce",2
White Linen By Estee Lauder For Women. Eau De Parfum Spray 2 Ounces,2
"Estee Lauder Revitalizing Supreme + Global Anti-Aging Cell Power Creme, 2.5 Ounce",2
"Estee Lauder Women's Nightwear Plus Anti-Oxidant Night Detox Creme, All Skin Types, 1.7 Ounce",2
Knowing By Estee Lauder For Women. Eau De Parfum Spray 2.5 oz,2
"Estee Lauder Resilience Lift Firming/Sculpting Face and Neck Creme SPF 15 Normal/Combination Skin, 1 oz",2
"Estee Lauder Nutritious Vitality8 Radiant Moisture Creme, 1.7 Ounce",2
"Estee Lauder Pleasures Intense Eau de Parfum Splash, 3.4 Ounce",2
"Estee Lauder Resilience Lift Firming/Sculpting Eye Cream for Unisex, 0.5 Ounce",2
Estee Lauder Soft Clean Silky Hydrating Lotion 400ml/13.5oz,2
"Estee Lauder Resilience Multi-Effect Tri-Peptide Face and Neck Creme, 0.5 oz / 15ml, Travel Size Unboxed",2
"Estee Lauder Daywear Multi Protection Anti Oxidant Sheer Tint Release Moisturizer for Women, 1.7 Fluid Ounce",2
"Estee Lauder 'Pleasures' Eau de Parfum Spray, 1.7 oz",2
"Estee Lauder Daywear Advanced Multi-Protection SPF 15 Anti-Oxidant Creme for Unisex Normal/Combination Skin, 1 Ounce",2
"Renergie Lift Multi-Action Lifting and Firming Eye and Face Cream Set Includes Eye Cream, Broad Spectrum SPF 15 Day Cream and Night Cream",2
La Base Pro Perfecting Makeup Primer Smoothing Effect Oil Free 25ml/0.85oz by Lancome,2
"Lancôme La Vie Est Belle L'Eau de Parfum Spray, 3.4 Ounce",2
"Lancome Renergie Lift Multi-Action Lifting and Firming Cream, 1.7 Ounce",2
Absolue Premium Bx Replenishing and Rejuvenating Day + Night + Eye,2
La Vie Est Belle by Lancome for Women 3.4 oz L'Eau de Parfum Spray,2
"New! Lot 2 x Absolue Premium Bx SPF 15 Replenishing and Rejuvenating Day Cream, 0.5 oz each",2
Lancôme Effacernes Waterproof Protective Undereye Natural-Looking Concealer (CLAIR LL),2
"Lancome Cils Booster Xl Mascara Enhancing Base Full Size, 0.18oz",2
"Lancome Absolue Eye Precious Cells Intense Revitalizing Eye Cream, 0.7 Ounce",2
Lancome Teint Idole Ultra 24 Hour Makeup Foundation- 220 Buff (C) 1 fl. oz.,2
Lancome Creme Radiance Clarifying Cream-to-Foam Cleanser 4.2 Ounce Full Size,2
"Lancome Advanced Genifique Youth Activating Con centrate, 1.08ounce/32milliliter (Set of 4 Travel Size 0.27ounce each)     ",2
"Lancome Lancome Advanced Genifique Yeux Light-pearl Eye-illuminating Youth Activating Concentrate 20ml/0.67oz, 0.67 Oz",2
2 x Lancome Renergie Lift Multi-Action Sunscreen Broad Spectrum SPF 15 Lifting and Firming Cream All Skin Types 0.5 OZ.(15g),2
"Lancome Renergie Nuit Multi-Lift Firming Anti-Wrinkle Night Cream for Unisex, 1.7 Ounce",2
"Lancome Tonique Confort Rehydrating Lotion, 6.7-Ounce",2
"Bi-Facil Double Action Eye Makeup Remover, 4.2 oz 125Ml",2
Lancome Visionnaire Advanced Skin Corrector 50ml/1.7oz,2
Crème Mousse Confort Comforting Cleanser Creamy Foam Dry Skin 4.2oz,2
"Lancome Le Parisian Cosmetic Faux Leather Train Case, Black",2
"Lancome 2018 Holiday Beauty Box in GLOW Collection, 10 Full Size Best Sellers Favorites Set",2
"Lancome Visionnaire Yeux Advanced Multi-Correcting Eye Balm, 0.5 Ounce",2
Bienfait Multi-Vital SPF 30 Lotion Day Cream: 24-Hour Moisturizing Lotion Antioxidant and Vitamin Enriched Broad Spectrum SPF 30 Sunscreen and Moisturizer       ,2
"Lancome Grandiose Wide-Angle Fan Effect Mascara, Noir Mirifique, 0.35 Ounce",2
"Lancome La Vie Est Belle Eau de Parfum Spray, 1.7 Ounce",2
"Lancome Absolue Precious Cells Nourishing Lip Balm, 0.17 OZ/5ml each(pack 2) unbox",2
Lancome - BIENFAIT UV SPF 50+,2
Lancome Confort Tonique - Comforting Rehydrating Toner - 6.7 Ounce,2
"Lancome Confort Galatee, Dry Skin, 13.5 Ounce",2
Renergie Lift Multi-Action Night Lifting And Firming Night Cream (Unboxed) 75ml/2.6oz,2
"Lancome Tonique Douceur, 13.4 Ounce",2
Lancôme Dual Finish Versatile Multi-tasking Powder and Foundation Makeup (Matte Bisque II),2
LANCOME PARIS Nutrix Royal Body Intense Nourishing & Restoring Body Butter (Dry to Very Dry Skin) 200ml/6.7oz,2
Lancome Renergie Night Treatment 50ml/1.7oz,2
Miracle By Lancome For Women. Eau De Parfum Spray 1 Ounces,2
"Lancome Genifique Repair Youth Activating Night Cream, 1.7 Ounce",2
Renergie Lift Multi-Action Sunscreen Broad Spectrum SPF 15 Lifting and Firming Cream All Skin Types 0.5 OZ.(15g),2
"LANCÔME Advanced Genifique Concentre Activateur, 0.27 oz/each 1.08 Oz total, (Pack of 4)",2
"Lancome Renergie Yeux Multi-Lift Lifting Firming Anti-Wrinkle Eye Cream, 0.51 Ounce",2
Lancome Cils Booster XL Mascara Enhancing Base Full Size 5.2g/0.17oz,2
HALO Bolt 58830 mWh Portable Phone Laptop Charger Car Jump Starter with AC Outlet and Car Charger - Rose Gold,3
"HALO Bassinest Swivel Sleeper Premiere Series Bassinet, Luna",19
HALO: Renegades,7
BOOMco DXD58 HALO UNSC MA5 Blaster,12
"HALO SleepSack Micro-Fleece Swaddle, Baby Blue, Small",19
"HALO Bassinest Glide Sleeper, Mosaic",19
"Halo Snoozypod Vibrating Bedtime Soother, White",19
"Halo Bassinest Swivel Sleeper Bassinet - Essentia Series, White, Blue Ikat",19
"Halo Sleepsack Micro-Fleece Wearable Baby Blanket, Soft Pink, Medium",19
"HALO 3-in-1 DreamNest Rocking Bassinet, Portable Crib, Travel Cot with Breathable Mesh Mattress",19
"HALO SleepSack Plush Dot Velboa Swaddle, Cream, Newborn",19
"Halo SleepSack, Micro-fleece, Elephant Texture, Gray, Medium",19
"Love To Dream Swaddle UP, Gray, Medium, 13-18.5 lbs, Dramatically Better Sleep, Allow Baby to Sleep in Their Preferred arms up Position for self-Soothing, snug fit Calms Startle Reflex",19
OCCObaby Universal Bassinet Wedge | Waterproof Layer & Handcrafted Cotton Removable Cover | 12-degree Incline for Better Night's Sleep,19
"Halo Swaddlesure Adjustable Swaddling Pouch, Elephant, Newborn",19
"Burt's Bees Baby - Beekeeper Wearable Blanket, 100% Organic Cotton, Swaddle Transition Sleeping Bag",19
"Halo Sleepsack Cotton Wearable Blanket, Huggy Bears, Medium",19
"HALO Early Walker Sleepsack Lightweight Knit Wearable Blanket, Blue, Large",19
"HALO Bassinest Swivel Sleeper Fitted Sheet, 100% Cotton, Grey Pin Dot",19
"Simmons Kids by The Bed City Sleeper Bassinet, Grey Tweed",19
"Halo SleepSack Swaddle, 100% Cotton, Triangle Neutral, Multi, Small",19
"Halo - SleepSack 3-way Adjustable Baby Swaddle, 100% Cotton - Neutral Triangles, Newborn",19
"HALO SleepSack Plush Dot Velboa Wearable Blanket, Pink, Medium",19
"HALO Winter Weight SleepSack, Blue, Large",5
"HALO Bassinest Swivel Sleeper Luxe Plus Series Bassinet, Grey Melange",19
Motorola Halo+ Over-The-Crib Baby Monitor & Soother with HD Wi-Fi Camera & Parent Unit,19
LilliJoy Premium Bassinet Wedge Pillow for Baby | Fits Halo Bassinet | 12˚ Incline Sleep Positioner for Elevated Head & Torso Support | Anti Reflux Sleeper for Infant or Newborn Colic & Congestion,19
"Halo Bassinest Swivel Sleeper Mattress Pad Waterproof Polyester, White",11
"SwaddleMe Original Swaddle 3-PK, Coral Days (SM)",19
"Halo 100% Cotton Muslin Sleepsack Wearable Blanket, Llama Print, Small",19
"HALO Early Walker SleepSack Micro Fleece Wearable Blanket Pink, Large",19
Handmade Adjustable Flower Wreath Headband Halo Floral Crown Garland Headpiece Wedding Festival Party,5
"Fisher-Price Soothing Motions Bassinet, Windmill",19
Hudson Baby Unisex Baby Safe Sleep Wearable Muslin Sleeping Bag,19
"Swaddle Blanket, Adjustable Infant Baby Wrap, Soft Cotton in Ultra Grey",19
Motorola Halo Over-The-Crib Baby Monitor & Soother with HD Wi-Fi Camera,19
100% Cotton Wearable Blanket Baby Sleep Bag Grey Stars 2 Pack (6-12 Months),19
Floral Fall Artificial Baby Breath Flower Halo Wedding Crown Lilac Bridal Headpiece Greenery Crown HC-24,11
"HALO Big Kids Sleepsack Lightweight Knit Wearable Blanket, Blue, 4-5T",11
"2in1 Rocking Bassinet One-Second Fold Travel Crib Portable Newborn Baby,Gray",19
"SwaddleDesigns Cotton Muslin Sleeping Sack with 2-Way Zipper, Black Hedgehog with Gray Trim, Medium",19
Tiny Love Meadow Days Take Along Mobile,19
Lullaby Baby CPSC Lab Approved Large Wedge Pillow Infant Newborn Waterproof Large Size Memory Foam Foldable 12 Degree Incline Sleeper Acid Reflux for Bassinet,19
"HALO SleepSack Wearable Blanket, Velboa, Pink Plush Dots, Large",19
"Halo Safe Dreams Poly Knit Wearable Baby Blanket, Grey Dot, Small",19
"Apple iPhone 8 Plus, GSM Unlocked, 64GB - Gold (Refurbished)",3
"Apple iPhone 8 Plus, Fully Unlocked, 256GB - Gold (Renewed)",3
"Apple iPhone 8, Fully Unlocked, 64GB - Red (Renewed)",3
"Apple iPhone 7, Fully Unlocked, 32GB - Black (Renewed)",3
"Glucosamine & Chondroitin Advanced Joint Health Supplement Tablets, Move Free (200 count in a bottle), Supports Mobility, Flexibility, Strength, Lubrication and Comfort",10
 Schiff Move Free Ultra 75 Coated Tablets - pack of 2,10
"Glucosamine and Chondroitin Plus MSM & D3 Advanced Joint Health Supplement Tablets, Move Free (120 count in a bottle), Supports Mobility, Comfort, Strength, Flexibility and Lubrication",10
"Glucosamine & Chondroiton Plus MSM Advanced Joint Health Supplement Tablets, Move Free (120 count in a bottle), Supports Mobility, Flexibility, Strength, Lubrication and Comfort",10
"Type II Collagen, Boron & HA Ultra Triple Action Tablets, Move Free (60 count in a value pack), Joint Health Supplement With Just 1 Tiny Pill Per Day To Promote Joint, Cartilage and Bone Health",10
"Move Free Advanced Glucosamine Chondroitin MSM Vitamin D3 and Hyaluronic Acid Joint Supplement, 80 Count",10
"Move Free Advanced Ultra 2-in-1 with Comfortmax, Clinically Proven Joint Support, 60 Count",10
"Glucosamine & Chondroitin Advanced Joint Health Supplement Tablets, Move Free (160 count in a bottle), Supports Mobility, Flexibility, Strength, Lubrication and Comfort",10
"Move Free Ultra Triple Action Joint Supplement with Type II Collagen, Hyaluronic Acid, and Boron for Joint, Cartilage, and Bone Support, Pack of 1, 75 Count",10
"Type II Collagen, Boron & HA Ultra Triple Action Tablets, Move Free (30 count in a bottle), Joint Health Supplement With Just 1 Tiny Pill Per Day To Promote Joint, Cartilage and Bone Health",10
"Move Free Triple Strength Glucosamine Chondroitin and Hyaluronic Acid Joint Supplement, 80 Count",10
"Move Free Advanced, 170 tablets - Joint Health Supplement with Glucosamine and Chondroitin",10
Move Free Advanced Plus MSM and Vitamin D3 Joint Health Supplement with Glucosamine and Chondroitin 80 ct (Pack of 4),10
"Move Free Ultra Omega, 30 softgels - Joint Health Supplement with Omega-3 Krill Oil and Hyaluronic Acid",10
"Move Free Advanced Plus MSM, 120 tablets - Joint Health Supplement with Glucosamine and Chondroitin (Pack of 2)",10
"Turmeric & Tamarind Ultra Joint Health Supplement, Move Free (64Count in a Bottle), Clinically Proven Joint Comfort in 1 Tiny Pill A Day",10
"Move Free Ultra 2 in 1 with Comfort Max, Clinically Proven Joint Support 30 ea",10
"Move Free Advanced, 2-Pack or 400 Tablets",10
"Move Free - Ultra Omega Joint Comfort Softgel, 30 Count 11780 (DMi EA",10
"Move Free Advanced ultra tablets, 60 Count",10
"Glucosamine with Chondroitin Turmeric MSM Boswellia - Joint Pain Relief Supplement - Anti-Inflammatory & Antioxidant Pills by Vimerson Health for Your Back, Knees, Hands - Natural & Non-GMO - 90 Caps",10
"Move Free Ultra Triple Action, 30 Tablets - Joint Health Supplement with Type II Collagen, Boron and HA",10
"Schiff Move Free Ultra - Collagen and Hyaluronic Acid - 2 Bottles, 60 Tablets Each",10
"Move Free Advanced, 80 tablets - Joint Health Supplement with Glucosamine and Chondroitin",10
"Move Free Ultra Omega, 30 softgels - Joint Health Supplement with Omega-3 Krill Oil and Hyaluronic Acid (Pack of 4)",10
"Move Free Advanced, Joint Health Supplement with Glucosamine and Chondroitin (200 Count) iiiIII",10
Schiff Move Free Ultra Triple-Action Tablets (75 count),10
"Move Free Ultra with UC-II Joint Health Tablet, 30 Count",10
"Move Free Advanced Plus MSM, 120 tablets - Joint Health Supplement with Glucosamine and Chondroitin , 6 Pack",10
"Move Free Advanced, Joint Health (200 ct.)",10
Free People Women's Move Along V-Neck Stretch Bodysuit         ,5
"Move Free Advanced Triple Strength, 170 Count(Size: One Bottle of 170 Tablets) by Move Free Advanced",10
Simple Joys by Carter's Baby and Toddler Girls' 2-Pack Short-Sleeve and Sleeveless Dress Sets,5
Carter's/OshKosh B’gosh Gift Card,20
Simple Joys by Carter's Baby Boys' 4-Pack Pant,5
Simple Joys by Carter's Baby and Toddler Boys' 3-Pack Loose Fit Fleece Footed Pajamas,5
Simple Joys by Carter's Baby and Toddler Girls' 3-Pack Snug Fit Footed Cotton Pajamas,5
Simple Joys by Carter's Baby Boys' 2-Pack Cotton Footed Sleep and Play,5
Simple Joys by Carter's Baby 7-Pack Long-Sleeve Bodysuit,5
Simple Joys by Carter's Baby Girls' 4-Pack Pant,5
Simple Joys by Carter's Baby Girls' 5-Pack Long-Sleeve Bodysuit,5
Simple Joys by Carter's Baby Girls' 2-Pack Fleece Footed Sleep and Play,5
Simple Joys by Carter's Baby Boys' 3-Pack Rompers,5
Simple Joys by Carter's Baby 8-Pack Short-Sleeve Bodysuit,5
Simple Joys by Carter's Baby and Toddler Boys' 3-Pack Snug Fit Footed Cotton Pajamas,5
Carter's Baby Boys' Cardigan Sets 121h271,5
Simple Joys by Carter's Baby Boys' 2-Pack Fleece Footed Sleep and Play,5
"Simple Joys by Carter's Baby, Little Kid, and Toddler Boys' 6-Piece Snug Fit Cotton Pajama Set",5
Simple Joys by Carter's Baby 2-Pack Cotton Footed Sleep and Play,5
Simple Joys by Carter's Baby and Toddler Girls' 3-Pack Snug Fit Footless Cotton Pajamas,5
Simple Joys by Carter's Baby and Toddler Girls' 3-Pack Loose Fit Fleece Footed Pajamas,5
Simple Joys by Carter's Baby Girls' 2-Pack Cotton Footed Sleep and Play,5
Carter's Baby Girls' 8 Pack Short Sleeve Bodysuits,5
Carter's Baby Boys' Multi-pk Bodysuits 126g402,5
Simple Joys by Carter's Baby Boys' 5-Pack Long-Sleeve Bodysuit,5
Simple Joys by Carter's Baby Girls' 6-Pack Short-Sleeve Bodysuit,5
"Simple Joys by Carter's Baby, Little Kid, and Toddler Girls' 6-Piece Snug Fit Cotton Pajama Set",5
"Simple Joys by Carter's Baby Girls' 3-Pack Romper, Sunsuit and Dress",5
Simple Joys by Carter's Baby 2-Pack Fleece Footed Sleep and Play,5
Simple Joys by Carter's Baby 2-Pack Knit Cardigan Sweaters,5
Simple Joys by Carter's Baby and Toddler Boys' 3-Pack Snug Fit Footless Cotton Pajamas,5
Carter's Girls' 7-Pack Print Days Underwear,5
Carter's Baby Girls' 7-Pack Long-Sleeve Bodysuits,5
"Simple Joys by Carter's Baby Girls' 4-Piece Fleece Jacket, Pant, and Bodysuit Set",5
Simple Joys by Carter's Baby and Toddler Girls' 3-Pack Loose Fit Polyester Jersey Footed Pajamas,5
"Carter's Baby Girls' 5 Pack Bodysuits (Baby), Kitty Love",5
Carter's Baby Boys' One Piece Rompers (Pack of 2),5
"Simple Joys by Carter's Baby Girls' 4-Piece Jacket, Pant, and Bodysuit Set",5
Simple Joys by Carter's Baby 5-Pack Long-Sleeve Bodysuit,5
Simple Joys by Carter's Baby Girls' 6-Pack Sleeveless Bodysuit,5
Carter's Boys' 4 Pc Cotton 341g280,5
Carter's Girls' 2-Pack Cotton Sleep and Play,5
Carter's Baby Girl Diaper Cover Set Blue Multi Embroidery,5
Simple Joys by Carter's Baby Boys' 4-Piece Playwear Set,5
"Simple Joys by Carter's Baby Girls' 3-Piece Short-Sleeve Top, Dress, and Pants Playwear Set",5
Simple Joys by Carter's Baby 6-Pack Short-Sleeve Bodysuit,5
Simple Joys by Carter's Baby Girls' 6-Piece Bodysuits (Short and Long Sleeve) and Pants Set,5
