name,category
"Alienware M15 Thin and Light 15"" Gaming Laptop i7-8750H, GTX 1070 Max Q, 128GB NVMe SSD + 1TB SSHD,  16GB DDR4 2666Mhz, 17.9mm Thick & 4.78lbs, Magnesium Alloy Chassis",4
Coach Signature Zip File Crossbody Bag,5
"Apple iPhone 8, Unlocked, 64GB - Space Gray (Renewed)",3
"Estee Lauder Revitalizing Supreme + Global Anti-Aging Cell Power Creme, 1.7 Ounce",2
Columbia Men's RFID Leather Wallet - Big Skinny Trifold Vertical Security Protection Credit Card Slots and ID Window,5
CHȂNEL Coco Mademoiselle Eau De Parfum spray For Women 3.4 OZ.,2
Chanel: Collections and Creations,7
CHANEL Black Quilted Satin Paris Limited Flap Bag (Pre-Owned),5
Bleu De_Chanel for Men Eau De Toilette Spray 3.4oz NEW in BOX,2
C h a n e l Chance Tendre Eau de Toilette Spray For Women 1.7 OZ./ 50 ml.,2
Chanel: The Complete Karl Lagerfeld Collections (Catwalk),7
CHANEL Black Patent Leather & Sequin Boy Small (Pre-Owned),5
"Chânel No.5 Eau De Parfum Spray for Woman, EDP 1.7 Ounces 50 ML",2
Chanel: Fashion/ Fine Jewellery/ Perfume (Set of 3 Books) (Memoire),7
Fashion wall art #A107 - Set of 4 (8x10) art prints. Fashion poster. Illustration. art print.Chanel poster.artwork.Fashin pictures.makeup poster,8
C.h.a.n.e.l Coco Mademoiselle Eau De Parfum Spray 3.4oz 100ml.,2
I'm Chanel - Doing Chanel Things T-Shirt | Cute Name Gift,5
CHANEL: A girl should be two things: classy and fabulous.,7
Chanel LES BEIGES HEALTHY GLOW Natural Eyeshadow Palette New in Box,2
CHANEL Black Quilted Calfskin Cambon Ligne Bowler (Pre-Owned),5
Chane'l No. 5 Leau Vial Sample,21
"Set Glam Fashion wall pop art print - Illustration -Fashion Perfume Bag, Shoes, Graffiti Chanel, Vinyl Logo - Chic Vogue poster on Fine Art Paper 8""x10"" 1029, 683, 645",8
Chanel 5131-H Sunglasses Color 501/3C Black Size 60MM,5
Chanel Coco Body Cream 150ml,2
Pocket Coco Chanel Wisdom: Witty Quotes and Wise Words from a Fashion Icon (Pocket Wisdom),7
"Chancè Chanèl Eau Fraiche Eau De Toilette Spray, for Woman EDT 1.7 fl oz, 50 ml",2
HYDRA BEAUTY CRÈME HYDRATION PROTECTION RADIANCE 50 G.,2
Coco Chanel: The Illustrated World of a Fashion Icon,7
Dior Addict Lip Glow Color Awakening Lip Balm SPF 10 by Christian Dior for Women - 0.12 oz Lip Color,2
Chanel and Her World,7
CHANEL LE LIFT FIRMING - ANTI-WRINKLE EYE CREAM 15G.,2
Les Beiges Healthy Glow Sheer Colour Broad Spectrum SPF 15 Sunscreen # 30,2
CHANEL LE Volume DE Waterproof# 10 Noir New in Box,2
"Chanel No. 5 Body Lotion 6.8 ounces, 200 milliliters Perfumed Luxury Body",2
Coco Chanel & Igor Stravinsky,9
CHANEL Black Quilted Calfskin Boy Medium (Renewed),5
Chanel Signature Gift Box 8.75x 5.5X 3 Inches,10
Chanel Pins - Chanel Quotes - Chanel Perfume - Chanel Logo - Chanel Art - LGBT Jewelry - Chanel Gifts - Chanel No 5 - Chanel Men,8
"ZZYBIA Wristlet Clutch 2 way Coin Zip Mobile Case, Card Holder with Detachable Long Chain",3
CHANEL. MIROIR DOUBLE FACETTES (1 PCE),2
"Set Fashion wall pop art print - Illustration -Fashion Perfume Bag, Shoes, Graffiti Chanel, Logo - Chic Glam Vogue poster on Fine Art Paper 1047",8
Perfume Bottle Image Design Print Pattern Electrical Outlet Plate,11
"Chanel Hand Cream for Unisex, 1.7 Ounce",2
Danielle Boy Bag Purse - Silicone Shoulder Bag with Adjustable Straps - Navy  - Crimson Strap-Navy Pom Pom Keychain - Girls & Teen Accessories  - Dress-Up,12
"Apple iPhone 6s 64GB Unlocked Smartphone, GSM Only (AT&T/T-Mobile), Rose Gold (Refurbished)",3
"Apple iPhone 6, GSM Unlocked, 64GB - Space Gray (Refurbished)",3
"Apple iPhone 7 , Fully Unlocked, 32GB - Rose Gold (Renewed)",3
"Apple iPhone 6, GSM Unlocked, 16GB - Space Gray (Renewed)",3
"Apple iPhone 7, Fully Unlocked, 128GB - Rose Gold (Renewed)",3
"Apple iPhone 6S, GSM Unlocked, 16GB - Rose Gold (Refurbished)",3
"Apple iPhone 7 , GSM Unlocked, 128GB - Gold (Renewed)",3
"Apple iPhone 6S, Fully Unlocked, 64GB - Rose Gold (Renewed)",3
"Apple iPhone 7, GSM Unlocked, 32GB - Rose Gold (Refurbished)",3
"Apple iPhone 6, GSM Unlocked, 16GB - Gold (Renewed)",3
"Apple iPhone X, Fully Unlocked, 256GB - Space Gray (Renewed)",3
"Apple iPhone 6S, GSM Unlocked, 16GB - Space Grey (Refurbished)",3
"Apple iPhone 5S 16GB GSM Unlocked, Silver (Renewed)",3
"Apple iPhone 7 Plus, GSM Unlocked, 32GB - Black (Refurbished)",3
"Apple iPhone 6S, Fully Unlocked, 16GB - Rose Gold (Renewed)",3
POUDRE UNIVERSELLE LIBRE Natural Finish Loose Powder Color: 30 Naturel - Translucent 2,2
"Wall Art  Poster Print on Fine Art Paper- COCO CHANEL, Shoes, Book, Handbag Vogue - Famous Fashion Quote - Black WaterColor- 644, 645, 638",8
"Apple iPhone 6 Plus, GSM Unlocked, 16GB - Silver (Refurbished)",3
"Apple iPhone X, GSM Unlocked, 64GB - Space Gray (Refurbished)",3
"Apple iPhone 8, GSM Unlocked, 64GB - Space Gray (Renewed)",3
"Apple iPhone 8, GSM Unlocked, 64GB - Gold (Renewed)",3
"Apple iPhone 8, Fully Unlocked, 256GB - Space Gray (Renewed)",3
"Apple iPhone 8 64GB GSM Unlocked Smartphone, RED (Renewed)",3
"Apple iPhone 8, GSM Unlocked, 64GB (Renewed)",3
"Apple iPhone 8 Plus, Fully Unlocked, 64GB - Red (Renewed)",3
"Apple iPhone 8 Plus, GSM Unlocked, 64GB - Space Gray (Renewed)",3
"Apple iPhone 8 Plus 64GB Red (special edition Product RED) A1897 - Factory Unlocked - GSM ONLY, NO CDMA (Renewed)",3
"Apple iPhone 8, AT&T, 64GB - Space Gray (Renewed)",3
"Apple iPhone 8 Plus, Fully Unlocked, 64GB - Gold (Renewed)",3
Sony Alpha a6000 Mirrorless Digital Camera 24.3MP SLR Camera with 3.0-Inch LCD (Black) w/16-50mm Power Zoom Lens,4
Sony DSCW800/B 20.1 MP Digital Camera (Black),4
Sony (DSCW800) 20.1 MP Digital Camera (Silver),4
Sony DSCW830 20.1 MP Digital Camera with 2.7-Inch LCD (Silver),4
Sony Alpha a6000 Mirrorless Camera w/16-50mm & 55-210mm Lenses & 128GB Bundle,4
Sony Cyber‑Shot RX10 IV with 0.03 Second Auto-Focus & 25x Optical Zoom (DSC-RX10M4),4
Sony Cyber-shot HX80 Compact Digital Camera with 30x Optical Zoom (Black) + 32GB SDHC Memory Dual Battery Kit + Accessory Bundle,4
Sony Alpha a6000 Mirrorless Digitial Camera 24.3MP SLR Camera with 3.0-Inch LCD (Black) w/ 16-50mm Power Zoom Lens (Renewed),4
Sony Alpha a7IIK Mirrorless Digital Camera with 28-70mm Lens,4
Sony Alpha a6000 Mirrorless Camera w/ 16-50mm Lens & Two 64GB SD Card Bundle,4
"Sony RX100 VI 20.1 MP Premium Compact Digital Camera w/ 1-inch sensor, 24-200mm ZEISS zoom lens and pop-up OLED EVF (DSCRX100M6/B)",4
"Sony a7 III Full-Frame Mirrorless Interchangeable-Lens Camera Optical with 3-Inch LCD, Black (ILCE7M3/B)",4
"Sony RX100 20.2 MP Premium Compact Digital Camera w/ 1-inch Sensor, 28-100mm ZEISS Zoom Lens, 3” LCD",4
Sony DSCWX350 18 MP Digital Camera (Black),4
Sony Cyber-shot DSC-H300 20.1 MP Digital Camera - Black - Renewed,4
Sony Alpha a6300 Mirrorless Digital Camera with E PZ 16-50mm F3.5-5.6 OSS Power Zoom Lens (Black),4
"Sony Alpha a6000 Mirrorless Digital Camera with 16-50mm & 55-210mm Lens (Black) ILCE-6000Y/B with 500mm Preset f/8 Telephoto Lens + 0.43x Wide Angle, 2.2X Pro Bundle",4
Sony Alpha a5100 HD 1080p Mirrorless Digital Camera White + 16-50mm Lens Kit + 32GB Accessory Bundle + DSLR Photo Bag + Extra Battery + Wide Angle Lens + 2x Telephoto Lens + Flash + Remote + Tripod,4
"Sony Alpha a6400 Mirrorless Camera: Compact APS-C Interchangeable Lens Digital Camera with Real-Time Eye Auto Focus, 4K Video, Flip Screen & 16-50mm Lens - E Mount Compatible Cameras - ILCE-6400L/B",4
Sony a5100 16-50mm Mirrorless Digital Camera with 3-Inch Flip Up LCD (Black),4
Sony Alpha a6000 24.3MP Wi-Fi Mirrorless Digital Camera + 16-50mm Lens Kit (Black) + 64GB SD Card + DSLR Photo Bag + Extra Battery + Wide Angle Lens + 2X Telephoto Lens + Flash Bundle,4
"Sony Alpha a6500 Mirrorless Digital Camera w/ 2.95"" LCD (Body Only)",4
Sony a68 Translucent Mirror DSLR Camera (Body Only),4
Sony Alpha a6000 Digital Camera Wi-Fi w/ 18-55mm 55-210mm Zoom Lens Bundle (Renewed),4
Sony Alpha A6000 Wi-Fi Digital Camera & 16-50mm Lens with E-Mount 55-210mm f/4.5-6.3 OSS Zoom Lens,4
"Sony a6000 Interchangeable Lens Digital Camera - Black (24.3MP, Body Only)",4
kinokoo Tempered Glass Film for Sony HX99/HX99V/WX800/WX700 Crystal Clear Film Sony HX99 HX99V WX800 WX700 Screen Protector Bubble-Free/Anti-Scratch(2 Pack),4
"LCD USB Dual Battery Charger for Sony Cyber-Shot DSC-RX100M2, DSC-RX100M3, DSC-RX100M4, DSC-RX100M5, DSC-RX100M5A, DSC-RX100M6, DSC-WX300, DSC-WX350, DSC-WX500, DSC-WX700, DSC-WX800 Digital Camera",4
"Sony STR-DH790 7.2-ch AV Receiver, 4K HDR, Dolby Vision, Dolby Atmos, dts:X, with Bluetooth",4
"Sony CT800 Powerful Sound bar with 4K HDR, Google Home Support, and Wireless Subwoofer (HT-CT800)",4
Diamondere Natural and Certified Gemstone Infinity Knot Solitaire Necklace in 14k White Gold | 0.41 Carat Pendant with Chain,5
14 Karat White Gold Oval Shape 3.50 Carats Created Blue Sapphire Diamond Pendant,5
14 Karat White Gold Princess Cut 3.50 Carats Created Blue Sapphire Pendant,5
"Amazon Essentials Sterling Silver Genuine or Created Round Cut Birthstone Pendant Necklace, 18""",5
Dainty Raw Gold Sapphire Pendant Necklace - 16 Inch Length Stones 5-8mm Tiny,8
"Vibrille Sterling Silver Created Gemstone Jewelry Halo Pendant Necklace for Women, 18''",5
"Ice Gems Sterling Silver Small Dainty Round Genuine, Simulated Gemstone or Cubic Zirconia Choker Necklace",5
Fine Jewelry for Women Birthday Mothers Day ❤️ I Love You to the Moon and Back ❤️ Necklace Blue Sapphire Pendant Sterling Silver Swarovski Jewelry for Her Anniversary Gifts for Wife,5
"Caperci Sterling Silver Lab-Created Gemstone Heart Shaped Pendant Necklace, 18''",5
"Small Blue Sapphire Necklace - September Birthstone - Avail in Silver, Gold and Rose Gold",8
Sterling Silver Genuine or Simulated Gemstone & White Topaz Round Halo Slide Necklace,5
JewelryPalace Gemstones Stone Birthstone Statement Necklace for Women 925 Sterling Silver Halo Pendant Necklace for Women Princess Diana William Kate Middleton Necklace Chain Box 18 Inches,5
"""Shape Of My Heart"" Sterling Silver 12 Months Heart Necklace Created Birthstone Pendant - Mother's Day Gifts",5
"Sterling Silver Genuine, Created or Simulated Gem Teardrop Halo Dangling Necklace & Leverback Earrings",5
Diamondere Natural and Certified Gemstone and Diamond Butterfly Necklace in 14k White Gold | 1.04 Carat Pendant with Chain,5
Gem Stone King 925 Sterling Silver Sapphire Dust Hourglass Pendant Necklace 0.75 Cttw Gemstone Birthstone with 18 Inch Silver Chain,5
"Ice Gems Sterling Silver Genuine, Created or Simulated and White Topaz Oval S Design Three-Stone Journey Necklace",5
"Caperci Sterling Silver Gemstone Created Blue Sapphire Infinity Pendant Necklace for Women, 18''",5
"Sterling Silver 4-Stone Genuine or Created Gemstone Pendant Necklace (4mm), 18”",5
Women's Natural Navy Blue Sapphire Gemstone Beads Necklace with Silver Clasp 19.5'' (49.5cm),8
ChicSilver Heart Necklace Love Garnet January Birthstone Necklace Sterling Silver CZ Halo Pendant Red Heart Jewelry Gifts for Women and Girls,5
"Sterling Silver Gem Cross Heart Pendant Necklace for Girls, Teens or Women",5
Star K Choice of 10k Gold or Sterling Silver Heart Shape 8mm Endless Love Pendant Necklace,5
Real Blue Sapphire Ombre Beaded Necklace Gold Rose Gold or Silver,8
Mothers Day Necklace Love Infinity Cross Sterling Silver Jewelry Birthday Gifts for Mom Women Red Garnet Pendants Swarovski Necklace,5
"14k White Gold Pear Sapphire Pendant with 18"" Chain",5
Amanda Rose Collection Sterling Silver Heart of The Ocean Created Blue and White Sapphire Pendant-Necklace (12ct tw),5
"Sterling Silver Genuine, Created or Simulated Gemstone Oval Halo Necklace & Leverback Earrings Set",5
Finejewelers Solid 10k White Gold 7mm Heart Shaped Center Stone Pendant Necklace,5
1 ct Created Sapphire Pendant Necklace with Diamonds in 10K Gold,5
September Birthstone Sapphire Quartz Necklace - Sterling Silver Briolette Teardrop Jewelry - Gift for Her,8
2 7/8 ct Created Sapphire Solitaire Pendant Necklace in 14K White Gold,5
14 Karat White Gold Pear Shape 2.50 Carats Created Blue Sapphire Diamond Pendant,5
"Sterling Silver Genuine, Created or Simulated Gemstones and White Topaz Oval Halo Necklace and Stud Earrings Set",5
"Ice Gems Sterling Silver Small Dainty Heart Genuine, Simulated Gemstone or Cubic Zirconia Choker Necklace",5
Elda&Co Blue Sapphire Necklace Love Infinity or Heart Jewelry Sterling Silver Swarovski Gifts for Women,5
14 Karat White Gold Heart Shape 1.00 Carats Created Blue Sapphire Diamond Pendant,5
"Sterling Silver Genuine, Created or Simulated Gemstone 6mm Round Solitaire Bezel-Set Dainty Choker Necklace",5
"Caperci Sterling Silver Created Crystal Rhinestone Gemstone Double Heart Pendant Necklace, 18""",5
Merthus Antique Vintage 925 Sterling Silver Created Blue Sapphire Cluster Statement Necklace for Women,5
GuqiGuli 925 Sterling Silver Pendant Necklace Made with Lab-Created Gemstone,5
GEMMANCE Purple Butterfly Necklace Amethyst Pink Pendant Women Necklace Made with Swarovski Crystals Gifts for Her,5
"Sterling Silver Genuine, Simulated or Created Gemstone 7x7mm Heart Shaped Dainty Choker Necklace",5
Finejewelers Sterling Silver 7mm Round Center Stone Twist Pendant Necklace,5
"Sterling Silver Genuine, Created or Simulated Gemstone and White Topaz Round Halo Slide Short Choker Necklace for Girls, Teens or Women",5
"Sterling Silver Genuine, Created or Simulated Gemstone and White Topaz Accents Round Halo Necklace and Stud Earrings Set",5
"Sterling Silver Created Gemstone and Created White Sapphire Wrapped Heart Pendant Necklace, 18""",5
"Sterling Silver Created Ruby and White Sapphire Double Heart Pendant Necklace, 18""",5
"Unheated Blue Sapphire Necklace, GIA Certified, 1.05 Carats, Sri Lanka Origin, Brilliant Cut",8
Created Sapphire Pendant Earrings Necklace Set Sterling Silver Trillion Cut 2.25 Carats,5
"Unheated Ceylon Sapphire Necklace, GIA Certified, 1.05 Carats, Sri Lanka Origin, Brilliant Cut",8
"Blue Sapphire, Ruby and Created Opal Pendant Necklace 3.65 Carats (ctw) in Sterling Silver with Chain",5
14 Karat White Gold Pear Shape 1.00 Carats Created Blue Sapphire Diamond Pendant,5
Created Sapphire Pendant Necklace Sterling Silver Rhodium Nickel Finish 1.00 Carats Checker Cut,5
Belinda Jewelz Womens 14K Yellow Gold Bezel Round 7 mm Gemstone Pendant Necklace,5
Created Blue Sapphire Pendant Sterling Silver Bezel Set 2.75 Carats,5
925 Sterling Silver Diamond Sapphire Heart Pendant Charm Necklace Gemstone Fine Jewelry Gifts For Women For Her,5
Phetmanee Shop Carat Star 925 Silver White Sapphire Cocktail Ring Wedding Engagement Jewelry (8),11
FEDULK Womens Sunflower Jewelry Zirconia Rings with Side Stone Copper Leaf Eternity Band Gifts Elegant Rings,5
"Princess Cut Diamond - 11x14 Unframed Patent Print - Makes a Great Gift Under $15 for Gemologists, Jewelers or Bathroom Decor",8
Created Blue Sapphire Pendant Sterling Silver Rhodium Nickel Finish Radiant Cut 3.00 Carats,5
Rainbow Color Heart Pendant Necklace Sterling Silver Rhodium Nickel Finish 2.00 Carats,5
Created Sapphire Pendant Earrings Necklace Sterling Silver Rhodium Nickel Finish Oval Shape 1.75 Carats,5
925 Sterling Silver Created Sapphire Cubic Zirconia Cz Chain Necklace Set Pendant Charm Gemstone S Pear Birthstone Fine Jewelry Gifts For Women For Her,5
14 Karat White Gold Round Cut 2.50 Carats Created Blue Sapphire Pendant,5
"White Sapphire Beaded Necklace with Vermeil Clover Charm Studded with Cubic Zircon, Adjustable. (Designs May Vary)",8
Created Sapphire Pendant Earrings Necklace Sterling Silver Rhodium Nickel Finish Princess Cut 2 Carats,5
925 Sterling Silver Sapphire Pendant Charm Necklace Gemstone Fine Jewelry Gifts For Women For Her,5
Long Necklace With Brown And White Sapphire Beads and Freshwater Pearl Accents,8
Lanmi Elegant Jewelry 14K White Gold Natural Sapphire Necklace Women Real Diamond Sapphire Pendant,5
14 Karat White Gold Heart Shape 1.00 Carats Created Pink Sapphire Diamond Pendant,5
White Sapphire Beaded Rondelle Necklace with Cross Charm,8
Diamond & Blue Star Sapphire Pendant Necklace Sterling Silver or 14K Yellow Gold Plated Silver,5
14 Karat White Gold Round Cut 2.25 Carats Created Blue Sapphire Stud Earrings,5
"White Sapphire Beaded Necklace with Vermeil Trinket and Cubic Zircons, Adjustable",8
Created Sapphire Pendant Earrings Set Sterling Silver 10.25 Carats Snowflake Shape,5
925 Sterling Silver Diamond Mystique Platinum Plated Dia/sapphire 18 Inch Cro925 Chain Necklace Pendant Charm Cross Crucifix Fine Jewelry Gifts For Women For Her,5
14k Yellow Gold Diamond Sapphire Birthstone Pendant Charm Necklace September Oval Fine Jewelry Gifts For Women For Her,5
ANGARA Pear Blue Sapphire Teardrop Pendant Necklace for Women with Diamond in 14K White Gold (6x4mm Blue Sapphire),5
925 Sterling Silver Created Blue White Sapphire Pendant Charm Necklace Fancy Fine Jewelry Gifts For Women For Her,5
925 Sterling Silver Diamond Sapphire Oval Pendant Charm Necklace Gemstone Fine Jewelry Gifts For Women For Her,5
"Houston Diamond District 1/2-5 Carat Round Pink Sapphire 3 Prong Pendant Necklace (AAA Quality) W/ 16"" Gold Chain",5
"Princess Diana Inspired Halo Diamond & Blue Star Pendant Necklace Set In Yellow Gold Plated Silver .925 with 18"" Chain",5
Rare Multi Sapphire Nuggets Faceted Beads Necklace Huge Big Size 10x14 mm - 13x18 mm Graduation Good Quality 1800 Carats/Size- 10x14mm,13
14K Yellow Gold Jade Lucky Elephant Charm Pendant,5
Unique Kyanite Sapphire Beaded Necklace with Cubic Zircon Stones and Vermeil Charm and Trinkets,8
14k Yellow Gold Created Sapphire Bow Pendant Charm Necklace Set Birthstone September Fine Jewelry Gifts For Women For Her,5
"White Sapphire Beaded Necklace with Vermeil Cubic Zircon Trinket, Adjustable",8
925 Sterling Silver Floral Created Sapphire Pendant Charm Necklace Set Birthstone September Fine Jewelry Gifts For Women For Her,5
JSDY Womens Girls Bohemia Drawing Peacock Leaves Pendants Necklaces Earrings Set Blue,2
DesignSter Hollow Sapphire Blue Velvet Necklace Box - Long Chain Necklace Storage Case Jewelry Packaging Gift Box,5
Women Fashion Jewelry 925 Sterling Silver Blue Sapphire Claddagh Ring Set New (7),11
TOPUNDER Fashion Beautiful Womens Pendant Necklace Jewelry Chain by,5
"Baby Teething Necklace for Mom, ""Olivia"" (Sapphire)",19
Sterling Silver Simulated White Opal and Simulated Gemstone Round Halo Necklace,5
Moto G6 – 64 GB – Unlocked (AT&T/Sprint/T-Mobile/Verizon) – Deep Indigo – Prime Exclusive Phone,3
Moto G6 Play – 32 GB – Unlocked (AT&T/Sprint/T-Mobile/Verizon) – Deep Indigo – Prime Exclusive Phone,3
"Motorola Moto G6 (32GB, 3GB RAM) Dual SIM 5.7"" 4G LTE (GSM Only) Factory Unlocked Smartphone International Model XT1925-2 (Deep Indigo)",3
"Motorola Moto G6 Plus - 64GB - 5.9"" FHD+, Dual SIM 4G LTE GSM Factory Unlocked Smartphone International Model XT1926-7 (Deep Indigo)",3
Motorola Moto G6 XT1925-6 Smartphone GSM Unlocked and Verizon 32GB  Black Certified Renewed,3
"Motorola Moto G6 64GB + 4GB RAM XT1925-5 Dual SIM 5.7"" Max Vision Display LTE Factory Unlocked Smartphone (International Model) (Deep Indigo)…",3
"Motorola Moto G6 Play 32GB - Dual SIM 5.7"" 4G LTE (GSM Only) Factory Unlocked Smartphone International Version XT1922-5 (Deep Indigo)",3
Moto X (4th Generation) - with Amazon Alexa hands-free – 32 GB - Unlocked – Super Black - Prime Exclusive,3
Huawei Mate SE Factory Unlocked 5.93” - 4GB/64GB Octa-core Processor| 16MP + 2MP Dual Camera| GSM Only |Grey (US Warranty),3
Motorola Moto G6 XT1925-2 32GB 5.7in Dual SIM 4G LTE Factory Unlocked Smartphone International Model - No Warranty (Deep Indigo) (Renewed),3
"[2-Pack] Supershieldz for Motorola Moto G6 Tempered Glass Screen Protector, Anti-Scratch, Bubble Free, Lifetime Replacement",3
"Moto G6 Case, Moto G (6th Generation) Case, Sucnakp TPU Shock Absorption Technology Raised Bezels Protective Case Cover for Motorola Moto G6 5.7 Inch(Black)",3
Motorola Moto g6,3
"[4 Pack] Moto G6 Screen Protector, SPARIN Tempered Glass Screen Protector for Moto G6, Covers Viewable Display Only with Anti-Scratch/Response Quickly/Easy Installation/Bubble Free, 5.7 inch",3
"Motorola Moto G7+ Plus (64GB, 4GB RAM) Dual SIM 6.2"" 4G LTE (GSM Only) Factory Unlocked Smartphone International Model XT1965-2 (Deep Indigo)",3
Moto G7 with Alexa Hands-Free – Unlocked – 64 GB – Ceramic Black,3
"Motorola Moto G7 (64GB, 4GB RAM) Dual SIM 6.2"" 4G LTE (GSM Only) Factory Unlocked Smartphone International Model XT1962-4 (Clear White)",3
"Motorola Moto G7 Power (64GB, 4GB RAM) Dual SIM 6.2"" 4G LTE (GSM Only) Factory Unlocked Smartphone International Model XT1955-2 (Marine Blue)",3
Moto G7 Power with Alexa – Unlocked – 32 GB – Marine Blue,3
"SPARIN Moto G7 Case/Moto G7 Plus Case, [2 Pack] Soft Nature TPU Case with Camera Protection/Scratch Resistant/Shock Absorption for Motorola Moto G7 / Moto G7 Plus, Crystal Clear,6.2 inch",3
"Motorola Moto G7 Play XT1952 32GB+2GB RAM 5.7"" Max Vision LTE Factory Unlocked (International Model) (Deep Indigo)",3
"Moto G7 Case,Moto G7 Plus Case,Moto G (7th Generation) Case, E-outfit Slim Soft TPU Protective Rubber Bumper Case Cover for Motorola Moto G7/G7Plus Phone Black",3
"Moto G7 XT1962 Case, Lacass Premium Leather Flip Zipper Wallet Case Cover Stand Feature with Card Holder and Wrist Strap for Motorola Moto G7 /G7 Plus XT1965 6.2"" (Black)",3
"Nokia 7.1 - Android 9.0 Pie - 64 GB - 12+5 MP Dual Camera - Dual SIM Unlocked Smartphone (at&T/T-Mobile/MetroPCS/Cricket/H2O) - 5.84"" FHD+ HDR Screen - Blue - U.S. Warranty",3
"HOOMIL Case Compatible with Moto G7, Premium Leather Flip Wallet Phone Case for Motorola Moto G7 / Moto G7 Plus Cover (Black)",3
"Moto G7 Wallet Case, Motorola G7 Plus Case, [Flower Embossed] PU Leather Flip Protective Case Cover with Card Holder and Stand for Moto G7 & G7 Plus 6.2"" (Purple)",3
"Moto G7 Case, Moto G7 Plus Case with [9H Tempered Glass Screen Protector], Sunnyw Shock Absorption Anti-Scratch Silicone Plastic Dual Layer Hybrid Armor Cover for Motorola Moto G7/G7 Plus (Black)",3
Spigen Rugged Armor Designed for Moto G7 Case/Designed for Moto G7 Plus Case (2019) - Matte Black,3
Columbia Men's Holston Ridge Polarized Rectangular Sunglasses,5
Columbia Loma Vista Metal Frame Smoke Lens Men's Sunglasses C102S354996014070,6
Duduma Polarized Sports Sunglasses for Men Women Baseball Running Cycling Fishing Driving Golf Softball Hiking Sun Glasses Tr8116,6
Columbia Mens Titan Ridge,5
"J+S Premium Military Style Classic Aviator Sunglasses, Polarized, 100% UV protection",6
Hulislem S1 Sport Polarized Sunglasses FDA Approved,6
Columbia Men's By The Bluff Square Sunglasses,5
Columbia Men's Unparalleled Oval Sunglasses,5
Columbia Men's Utilizer UTILIZER-001 Polarized Wrap Sunglasses,5
Columbia Women's Horizons Pine Oval Sunglasses,5
Columbia- Unisex CBC302 Polarized Sunglasses,5
Duduma Polarized Sports Sunglasses for Running Cycling Fishing Golf Tr90 Unbreakable Frame,6
Columbia Men's Arbor Peak Polarized Wrap Sunglasses,5
RIVBOS Polarized Sports Sunglasses Driving Glasses Shades for Men TR90 Unbreakable Frame for Cycling Baseball RB831,6
Sunglasses Columbia C 505 S HAZEN 027 MATTE MERCURY/BLUE SKY FLASH,5
Columbia Men's Trails Edge Aviator Sunglasses,5
Columbia Womens Black Ridge,5
Columbia Men's Airgill Lite Polarized Oval Sunglasses,5
Columbia Women's Wildberry Cateye Sunglasses,5
Columbia Men's Zonafied Rectangular Sunglasses,5
Columbia Men's Point Reyes Rectangular Sunglasses,5
"Neptune (Gunmetal, Grey)",5
PAERDE Men's Polarized Sports Sunglasses for men Driving Cycling Fishing Golf Running Metal Frame Sun Glasses,6
Columbia Loma Vista Metal Frame Amber Lens Men's Sunglasses C102S354996014203,6
Columbia Men's Black Ridge Aviator Sunglasses,5
Columbia Men's Trail Warrior Rectangular Sunglasses,5
Columbia Men's Ridgestone Polarized Rectangular Sunglasses,5
Sunglasses Columbia HAZEN 223 MATTE NEW CINDER/BROWN,5
"Columbia Men's Blood and Guts III Short-Sleeve Sun Shirt, Waterproof",6
Columbia- Unisex CBC200 Polarized Sunglasses,5
Columbia Men's Vamoose Aviator Sunglasses,5
Pulabecs Men's Polarized Sports Sunglasses for Men and Women Cycling Running Fishing Driving Golf Unbreakable Al-Mg Metal Frame Glasses PS071,6
Columbia Unisex Canyons Bend Polarized Aviator Sunglasses,5
Columbia Notched Peak Polarized Lightweight Sunglasses 100% UV Protection,6
"Columbia Men’s PFG Mesh Ball Cap, Quick Drying",5
Columbia Loma Vista Metal Frame Blue Lens Men's Sunglasses C102SM355016014003,5
Sunglasses Columbia C 515 S ALPINE THISTLE 002 MATTE BLACK-SMOKE,5
Sunglasses Columbia C 532 S WILDER QUEST 002 MATTE BLACK-SMOKE,5
Columbia Men's PFG Blood & Guts III Long Sleeve Woven Shirt,6
Sunglasses Columbia ZONAFIED 001 BLACK SMOKE,5
"Columbia Men's PFG Bonehead II Long Sleeve Shirt, Cotton, Relaxed Fit",5
Columbia Big Katuna Ii Short,6
Sunglasses Columbia C 103 S KATCHOR 070 SATIN GUNMETAL/SMOKE,5
"Columbia Women's PFG Bahama Ii Long Sleeve Shirt, Breathable with Uv Protection",6
Columbia Loma Vista Metal Frame Orange Lens Men's Sunglasses C102SM355016014073,6
"Columbia Women's PFG Tamiami II Long Sleeve Shirt, UV Sun Protection, Moisture Wicking Fabric",5
Nike Men’s Air Force 1 Low Sneaker,5
"Air Jordan 1 Mid SE Men's Basketball Shoe (10.5 M US, Pine Green/Sail/Black)",5
AIR Jordan 1 RET HI OG (GS) 'Origin Story' - 575441-602,5
Nike Air Jordan 3 Retro Big Boy's Shoes White/Fire Red/Cement Grey 398614-116 (6.5 D(M) US),5
Nike Women’s Flex 2017 Rn Trainers,5
Nike Men’s Air Force 1 Mid 07 Trainers,5
Nike Air Jordan Mens Generation 23 Basketball Shoes AA1294 004 New (10),5
Nike Mens Air Jordan Spizike Basketball Shoes,5
AIR Jordan 3 Retro BG (GS) 398614-020,5
"Jordan Men's AIR Future Basketball Shoe, Black/Black/Anthracite-Metallic Black, 12 M US",5
"Air Jordan 1 Retro High OG NRG ""Gold Toe"" - 861428 007",5
Bulls Michael Jordan Signed 1990 Game Used Nike Air Jordan V Shoes BAS,15
Jordan Air True Flight,5
Nike Boys Air Jordan Mesh Athletic Basketball Shorts,5
Nike Mens Air Jordan Retro 1 Mid Basketball Shoes Black/Dark Grey/Black 554724-050 Size 9,5
Jordan Nike Mens Air 1 High Flyknit Basketball Shoes,5
AIR Jordan 1 MID 'Gym RED' - 554724-610,5
